{
  "run_id": "2026-05-10-task-status-activity",
  "timestamp_utc": "2026-05-10T23:26:23Z",
  "project_name": "Creation Station",
  "main_objective": "Add durable activity logging for real task status changes.",
  "status": "partially_completed",
  "repo_summary": "Next.js 16, React 19, TypeScript, Prisma SQLite local-first workflow app in v1.8 operator UX phase.",
  "acceptance_criteria": [
    "Every real allowed task status transition writes one task_status_changed activity event.",
    "No activity event is written when the submitted task status equals the current status.",
    "Existing task_completed and task_archived analytics behavior remains unchanged.",
    "No Prisma schema, dependency, or UI behavior change."
  ],
  "workers_hired": [
    {
      "role": "Product Strategist",
      "assignment": "Inspect roadmap and workflow docs for safest highest-leverage objective.",
      "result": "Recommended activity/event log foundation as v1.8 objective."
    },
    {
      "role": "Software Architect",
      "assignment": "Inspect stack, boundaries, risks, and small architecture-safe objective.",
      "result": "Recommended task_status_changed logging as the smallest no-schema activity gap."
    },
    {
      "role": "QA/Test Engineer",
      "assignment": "Identify verification commands for v1.8 activity-log work.",
      "result": "Recommended targeted Vitest, full unit, lint, typecheck, smoke, and e2e checks."
    },
    {
      "role": "Backend Engineer",
      "assignment": "Inspect server actions and activity logging for smallest backend-safe improvement.",
      "result": "Recommended updateTaskStatus activity logging with two focused tests."
    }
  ],
  "files_changed": [
    "src/app/actions.ts",
    "src/app/actions.test.ts",
    "agentops/PROJECT_STATE.md",
    "agentops/ROADMAP.md",
    "agentops/WORK_QUEUE.md",
    "agentops/DECISIONS.md",
    "agentops/REFLECTIONS.md",
    "agentops/BLOCKERS.md",
    "agentops/reports/2026-05-10-task-status-activity.json"
  ],
  "commands_run": [
    {
      "command": "npx vitest run src/lib/activity-log.test.ts src/app/actions.test.ts",
      "result": "passed: 2 files, 10 tests"
    },
    {
      "command": "npm run test",
      "result": "passed: 45 files, 283 tests"
    },
    {
      "command": "npm run lint",
      "result": "passed with 16 pre-existing warnings"
    },
    {
      "command": "npx tsc --noEmit",
      "result": "passed"
    },
    {
      "command": "npm run test:smoke",
      "result": "failed before tests: Playwright webServer could not start because prisma db push exited with Schema engine error"
    },
    {
      "command": "npx prisma validate",
      "result": "passed"
    },
    {
      "command": "npx prisma generate",
      "result": "passed"
    }
  ],
  "tests_or_checks": [
    {
      "name": "targeted Vitest",
      "status": "passed",
      "notes": "Activity log and server action tests passed."
    },
    {
      "name": "full Vitest",
      "status": "passed",
      "notes": "All 283 unit tests passed."
    },
    {
      "name": "lint",
      "status": "passed",
      "notes": "ESLint returned 0 errors and 16 warnings outside this change."
    },
    {
      "name": "TypeScript",
      "status": "passed",
      "notes": "npx tsc --noEmit completed successfully."
    },
    {
      "name": "Playwright smoke",
      "status": "failed",
      "notes": "Web server bootstrap failed at Prisma db push before browser tests started."
    }
  ],
  "decisions": [
    "Implement task_status_changed activity logging as the one main objective.",
    "Do not change schema, dependencies, UI, or workflow engine in this run.",
    "Record Prisma db push smoke failure as a blocker instead of altering the test harness."
  ],
  "risks": [
    "Smoke/e2e verification remains blocked by Prisma db push schema engine failure.",
    "Activity docs and code naming are not fully reconciled.",
    "Untracked .codex/.codex/ remains unresolved."
  ],
  "blockers": [
    "Prisma db push fails with Schema engine error during Playwright smoke webServer startup."
  ],
  "next_tasks": [
    "Investigate and fix Prisma db push schema engine failure.",
    "Re-run npm run test:smoke after the Prisma issue is resolved.",
    "Reconcile remaining activity event naming and coverage gaps."
  ],
  "summary": "Task status changes now create durable operator-visible activity events for real transitions, with focused tests and full unit/static verification passing. Browser smoke remains blocked by Prisma db push startup failure."
}
